{
  "$schema": "http://json-schema.org/draft-04/schema#",
  "title": "TY 2023-24 or before",
  "description": "This endpoint allows a developer to retrieve the income and expenses for a UK property business, that occurred between two dates. A National Insurance number, business ID, tax year and submission ID are required.",
  "type": "object",
  "properties": {
    "submittedOn": {
      "type": "string",
      "format": "date-time",
      "description": "The date the UK property were submitted, in the format `YYYY-MM-DDThh:mm:ss.SSSZ`",
      "example": "2020-07-07T10:59:47.544Z"
    },
    "fromDate": {
      "type": "string",
      "format": "date",
      "description": "The first day that the income and expenses period summary covers. Must conform to the format YYYY-MM-DD",
      "example": "2020-01-01"
    },
    "toDate": {
      "type": "string",
      "format": "date",
      "description": "The last day that the income and expenses period summary covers. Must conform to the format YYYY-MM-DD",
      "example": "2020-01-31"
    },
    "ukFhlProperty": {
      "type": "object",
      "description": "Object holding the income and expenses of the user's Furnished Holiday Letting (FHL) in the United Kingdom for the period. (At least one of income or expenses should be present).",
      "properties": {
        "income": {
          "type": "object",
          "description": "Object holding the income details for the period.",
          "properties": {
            "periodAmount": {
              "description": "Total rents from property, ground rents and rent charges but not rent-a-room. The value must be between 0 and 99999999999.99 up to 2 decimal places.",
              "type": "number",
              "multipleOf": 0.01,
              "minimum": 0.00,
              "maximum": 99999999999.99,
              "example": 5000.99
            },
            "taxDeducted": {
              "description": "The tax deducted from income. The value must be between 0 and 99999999999.99 up to 2 decimal places.",
              "type": "number",
              "multipleOf": 0.01,
              "minimum": 0.00,
              "maximum": 99999999999.99,
              "example": 5000.99
            },
            "rentARoom": {
              "type": "object",
              "description": "Object holding the rents received for the period.",
              "properties": {
                "rentsReceived": {
                  "description": "Total rents received from properties. The value must be between 0 and 99999999999.99 up to 2 decimal places.",
                  "type": "number",
                  "multipleOf": 0.01,
                  "minimum": 0.00,
                  "maximum": 99999999999.99,
                  "example": 5000.99
                }
              },
              "additionalProperties": false
            }
          },
          "additionalProperties": false
        },
        "expenses": {
          "type": "object",
          "description": "Object holding the expenses for the period.",
          "properties": {
            "premisesRunningCosts": {
              "description": "Rent, rates, insurance, ground rents and other costs. The value must be between 0.00 and 99999999999.99 up to 2 decimal places.",
              "type": "number",
              "multipleOf": 0.01,
              "minimum": 0.00,
              "maximum": 99999999999.99,
              "example": 5000.99
            },
            "repairsAndMaintenance": {
              "description": "Property repairs and maintenance. The value must be between 0.00 and 99999999999.99 up to 2 decimal places.",
              "type": "number",
              "multipleOf": 0.01,
              "minimum": 0.00,
              "maximum": 99999999999.99,
              "example": 5000.99
            },
            "financialCosts": {
              "description": "Loan interest and other financial costs. The value must be between 0.00 and 99999999999.99 up to 2 decimal places",
              "type": "number",
              "multipleOf": 0.01,
              "minimum": 0.00,
              "maximum": 99999999999.99,
              "example": 5000.99
            },
            "professionalFees": {
              "description": "Legal, management and other professional fees. The value must be between 0.00 and 99999999999.99 up to 2 decimal places.",
              "type": "number",
              "multipleOf": 0.01,
              "minimum": 0.00,
              "maximum": 99999999999.99,
              "example": 5000.99
            },
            "costOfServices": {
              "description": "Cost of services provided, including wages. The value must be between 0.00 and 99999999999.99 up to 2 decimal places.",
              "type": "number",
              "multipleOf": 0.01,
              "minimum": 0.00,
              "maximum": 99999999999.99,
              "example": 5000.99
            },
            "other": {
              "description": "Other allowable property expenses. The value must be between 0.00 and 99999999999.99 up to 2 decimal places.",
              "type": "number",
              "multipleOf": 0.01,
              "minimum": 0.00,
              "maximum": 99999999999.99,
              "example": 5000.99
            },
            "travelCosts": {
              "description": "Car, van and travel costs incurred in running a property business. The value must be between 0.00 and 99999999999.99 up to 2 decimal places.",
              "type": "number",
              "multipleOf": 0.01,
              "minimum": 0.00,
              "maximum": 99999999999.99,
              "example": 5000.99
            },
            "rentARoom": {
              "type": "object",
              "description": "Object holding the rents claimed for the period.",
              "properties": {
                "amountClaimed": {
                  "description": "The amount of UK Furnished Holiday Lettings rent claimed. The value must be between 0 and 99999999999.99 up to 2 decimal places.",
                  "type": "number",
                  "multipleOf": 0.01,
                  "minimum": 0.00,
                  "maximum": 99999999999.99,
                  "example": 5000.99
                }
              },
              "additionalProperties": false
            },
            "consolidatedExpenses": {
              "description": "The sum of all allowable expenses for the specified period. If consolidatedExpenses is returned, values for individual expenses (premisesRunningCosts, repairsAndMaintenance, financialCosts, professionalFees, costOfServices, other, travelCosts, rentARoom) are not returned. The value must be between 0.00 and 99999999999.99 up to 2 decimal places.",
              "type": "number",
              "multipleOf": 0.01,
              "minimum": 0.00,
              "maximum": 99999999999.99,
              "example": 5000.99
            }
          },
          "additionalProperties": false
        }
      },
      "additionalProperties": false
    },
    "ukNonFhlProperty": {
      "type": "object",
      "description": "Object  holding the income and expenses of the UK property business - excluding Furnished Holiday Lettings (FHL) for the period. (At least one of income or expenses should be present).",
      "properties": {
        "income": {
          "type": "object",
          "description": "Object holding the income details for the period.",
          "properties": {
            "premiumsOfLeaseGrant": {
              "description": "Premiums received for the grant of a lease and other lump sums to possess a property. The value must be between 0 and 99999999999.99 up to 2 decimal places.",
              "type": "number",
              "multipleOf": 0.01,
              "minimum": 0.00,
              "maximum": 99999999999.99,
              "example": 5000.99
            },
            "reversePremiums": {
              "description": "Amount paid by a landlord or outgoing tenant to induce a new tenant to enter into a leasehold agreement. The value must be between 0 and 99999999999.99 up to 2 decimal places.",
              "type": "number",
              "multipleOf": 0.01,
              "minimum": 0.00,
              "maximum": 99999999999.99,
              "example": 5000.99
            },
            "periodAmount": {
              "description": "Total rents from property (but not ground rents, rent charges and rent-a-room rental income). The value must be between 0 and 99999999999.99 up to 2 decimal places.",
              "type": "number",
              "multipleOf": 0.01,
              "minimum": 0.00,
              "maximum": 99999999999.99,
              "example": 5000.99
            },
            "taxDeducted": {
              "description": "Tax already deducted from the rental income. The value must be between 0 and 99999999999.99 up to 2 decimal places.",
              "type": "number",
              "multipleOf": 0.01,
              "minimum": 0.00,
              "maximum": 99999999999.99,
              "example": 5000.99
            },
            "otherIncome": {
              "description": "Other income from property, such as rent charges and ground rents, income from letting others tip waste on your land, and income for the use of a caravan or houseboat at a fixed location. The value must be between 0 and 99999999999.99 up to 2 decimal places.",
              "type": "number",
              "multipleOf": 0.01,
              "minimum": 0.00,
              "maximum": 99999999999.99,
              "example": 5000.99
            },
            "rentARoom": {
              "type": "object",
              "description": "Object holding the rents received for the period.",
              "properties": {
                "rentsReceived": {
                  "description": "Total rents received from properties. The value must be between 0 and 99999999999.99 up to 2 decimal places.",
                  "type": "number",
                  "multipleOf": 0.01,
                  "minimum": 0.00,
                  "maximum": 99999999999.99,
                  "example": 5000.99
                }
              },
              "additionalProperties": false
            }
          },
          "additionalProperties": false
        },
        "expenses": {
          "type": "object",
          "description": "Object holding the expenses for the period.",
          "properties": {
            "premisesRunningCosts": {
              "description": "Rent, rates, insurance, ground rents and other costs. The value must be between 0.00 and 99999999999.99 up to 2 decimal places.",
              "type": "number",
              "multipleOf": 0.01,
              "minimum": 0.00,
              "maximum": 99999999999.99,
              "example": 5000.99
            },
            "repairsAndMaintenance": {
              "description": "Property repairs and maintenance. The value must be between 0.00 and 99999999999.99 up to 2 decimal places.",
              "type": "number",
              "multipleOf": 0.01,
              "minimum": 0.00,
              "maximum": 99999999999.99,
              "example": 5000.99
            },
            "financialCosts": {
              "description": "Loan interest and other financial costs. The value must be between 0.00 and 99999999999.99 up to 2 decimal places.",
              "type": "number",
              "multipleOf": 0.01,
              "minimum": 0.00,
              "maximum": 99999999999.99,
              "example": 5000.99
            },
            "professionalFees": {
              "description": "Legal, management and other professional fees. The value must be between 0.00 and 99999999999.99 up to 2 decimal places.",
              "type": "number",
              "multipleOf": 0.01,
              "minimum": 0.00,
              "maximum": 99999999999.99,
              "example": 5000.99
            },
            "costOfServices": {
              "description": "Cost of services provided, including wages. The value must be between 0.00 and 99999999999.99 up to 2 decimal places.",
              "type": "number",
              "multipleOf": 0.01,
              "minimum": 0.00,
              "maximum": 99999999999.99,
              "example": 5000.99
            },
            "other": {
              "description": "Other allowable property expenses. The value must be between 0.00 and 99999999999.99 up to 2 decimal places.",
              "type": "number",
              "multipleOf": 0.01,
              "minimum": 0.00,
              "maximum": 99999999999.99,
              "example": 5000.99
            },
            "residentialFinancialCost": {
              "description": "The residential financial cost deductible from rental income (tax relief). The value must be between 0 and 99999999999.99 up to 2 decimal places.",
              "type": "number",
              "multipleOf": 0.01,
              "minimum": 0.00,
              "maximum": 99999999999.99,
              "example": 5000.99
            },
            "travelCosts": {
              "description": "Car, van and travel costs incurred in running a property business. The value must be between 0.00 and 99999999999.99 up to 2 decimal places.",
              "type": "number",
              "multipleOf": 0.01,
              "minimum": 0.00,
              "maximum": 99999999999.99,
              "example": 5000.99
            },
            "residentialFinancialCostsCarriedForward": {
              "description": "Amount of residential financial costs carried forward. The value must be between 0 and 99999999999.99 up to 2 decimal places.",
              "type": "number",
              "multipleOf": 0.01,
              "minimum": 0.00,
              "maximum": 99999999999.99,
              "example": 5000.99
            },
            "rentARoom": {
              "type": "object",
              "description": "Object holding the rents claimed for the period.",
              "properties": {
                "amountClaimed": {
                  "description": "The amount of UK Furnished Holiday Lettings rent claimed. The value must be between 0 and 99999999999.99 up to 2 decimal places.",
                  "type": "number",
                  "multipleOf": 0.01,
                  "minimum": 0.00,
                  "maximum": 99999999999.99,
                  "example": 5000.99
                }
              },
              "additionalProperties": false
            },
            "consolidatedExpenses": {
              "description": "The sum of all allowable expenses for the specified period. You can either submit a consolidatedExpenses value or individual expenses (premisesRunningCosts, repairsAndMaintenance, financialCosts, professionalFees, costOfServices, other, residentialFinancialCost, travelCosts, residentialFinancialCostsCarriedForward, rentARoom) The value must be between 0.00 and 99999999999.99 up to 2 decimal places.",
              "type": "number",
              "multipleOf": 0.01,
              "minimum": 0.00,
              "maximum": 99999999999.99,
              "example": 5000.99
            }
          },
          "additionalProperties": false
        }
      },
      "additionalProperties": false
    }
  },
  "required": [
    "submittedOn",
    "fromDate",
    "toDate"
  ],
  "additionalProperties": false
}