{
  "submittedOn": "2024-10-21T10:59:47.544Z",
  "fromDate": "2022-04-06",
  "toDate": "2022-07-04",
  "ukFhlProperty": {
    "income": {
      "periodAmount": 5000.99,
      "taxDeducted": 5000.99,
      "rentARoom": {
        "rentsReceived": 5000.99
      }
    },
    "expenses": {
      "premisesRunningCosts": 5000.99,
      "repairsAndMaintenance": 5000.99,
      "financialCosts": 5000.99,
      "professionalFees": 5000.99,
      "costOfServices": 5000.99,
      "other": 5000.99,
      "travelCosts": 5000.99,
      "rentARoom": {
        "amountClaimed": 5000.99
      }
    }
  },
  "ukNonFhlProperty": {
    "income": {
      "premiumsOfLeaseGrant": 5000.99,
      "reversePremiums": 5000.99,
      "periodAmount": 5000.99,
      "taxDeducted": 5000.99,
      "otherIncome": 5000.99,
      "rentARoom": {
        "rentsReceived": 5000.99
      }
    },
    "expenses": {
      "premisesRunningCosts": 5000.99,
      "repairsAndMaintenance": 5000.99,
      "financialCosts": 5000.99,
      "professionalFees": 5000.99,
      "costOfServices": 5000.99,
      "other": 5000.99,
      "residentialFinancialCost": 5000.99,
      "travelCosts": 5000.99,
      "residentialFinancialCostsCarriedForward": 5000.99,
      "rentARoom": {
        "amountClaimed": 5000.99
      }
    }
  }
}