{
  "submittedOn": "2024-10-21T10:59:47.544Z",
  "fromDate": "2024-07-06",
  "toDate": "2024-10-05",
  "ukFhlProperty": {
    "income": {
      "periodAmount": 5000.99,
      "taxDeducted": 3123.21,
      "rentARoom": {
        "rentsReceived": 532.12
      }
    },
    "expenses": {
      "consolidatedExpenses": 988.18
    }
  },
  "ukNonFhlProperty": {
    "income": {
      "premiumsOfLeaseGrant": 4889.23,
      "reversePremiums": 847.35,
      "periodAmount": 747.45,
      "taxDeducted": 984.29,
      "otherIncome": 954.32,
      "rentARoom": {
        "rentsReceived": 488.39
      }
    },
    "expenses": {
      "consolidatedExpenses": -1998.18
    }
  }
}